作成者,取扱会社種別,取扱事業所名,法人形態,顧客名,顧客名（カナ）,業種,会社規模,事業展開地域,取引拡大可能性,社歴,信頼性,所属部署,顧客担当者名,顧客住所,電話番号,メールアドレス,FAX
穂束 和美,HC,北九州本社,その他,長崎県土地家屋調査士会,ナガサキケントチカオクチョウサシカイ,学術研究・専門・技術サービス業,,地域限定,,,,,,長崎県長崎市桜町7-6-101サンガーデン桜町,095-828-0009,nagasaki@trust.ocn.ne.jp,095-828-2629
穂束 和美,PA,北九州本社,（後）株式会社,大東コーポレートサービス,ダイトウコーポレートサービス,サービス業（他に分類されないもの）,,複数地域,,創業10年以上,,,,東京都品川区東品川2-2-4,,,
穂束 和美,PA,北九州本社,（後）株式会社,北九州ふよう,キタキュウシュウフヨウ,サービス業（他に分類されないもの）,,地域限定,,創業30年以上,,,,福岡県北九州市小倉北区浅野2-14-1KMMビル6階,093-511-6460,,
穂束 和美,PA,北九州本社,（前）株式会社,東洋電機工業所,トウヨウデンキコウギョウショ,製造業,,全国展開,,創業30年以上,,,,福岡県北九州市八幡西区則松1-7-10,093-691-2731,,093-691-2728
穂束 和美,PA,北九州本社,（前）株式会社,ウインズ,ウインズ,不動産業・物品賃貸業,,地域限定,,創業10年以上,,,,福岡県北九州市小倉北区室町2-2-8リード室町1階,,,
穂束 和美,PA,北九州本社,（後）株式会社,アイギスセキュリティ,アイギスセキュリティ,サービス業（他に分類されないもの）,,地域限定,,創業10年以上,,,,福岡県北九州市八幡西区藤田4-2-13リブート黒崎,093-883-6180,,093-482-5861
穂束 和美,PA,北九州本社,（後）株式会社,大東建託パートナーズ,ダイトウケンタクパートナーズ,不動産業・物品賃貸業,,全国展開,,創業10年以上,,,,東京都港区港南二丁目16番1号 品川イーストワンタワー,,,
穂束 和美,PA,北九州本社,（前）株式会社,エコウッド,エコウッド,製造業,,複数地域,,創業10年以上,,,,福岡県北九州市若松区響町1-12-1,093-751-2424,,093‐751‐2430
穂束 和美,PA,北九州本社,（前）株式会社,ユキテック,ユキテック,製造業,,地域限定,,創業30年以上,,,,福岡県北九州市小倉北区赤坂海岸6-7,093-541-6931,,093-521-3252
穂束 和美,HC,北九州本社,（後）株式会社,大正伸鐵,タイショウシンテツ,製造業,,複数地域,,創業30年以上,,,,大阪府大阪市中央区南船場3-11-10心斎橋大陽ビル,093-751-2221,,093-751-2217
木下 雅文,PA,北九州本社,その他,公益財団法人北九州観光コンベンション協会,キタキュウシュウコンベンションキョウカイ,生活関連サービス業・娯楽業,,地域限定,,創業30年以上,,,,福岡県北九州市小倉北区浅野3-8-1,,,
木下 雅文,PA,北九州本社,その他,公益財団法人北九州市芸術文化振興財団,キタキュウシュウシゲイジュツブンカシンコウザイダン,生活関連サービス業・娯楽業,,地域限定,,創業30年以上,,,,福岡県北九州市小倉北区室町1-1-1-11リバーウォーク北九州5階,093-562-3016,,093-562-3017
木下 雅文,PA,北九州本社,その他,中間市役所,ナカマシヤクショ,公務（他に分類されるものを除く）,,地域限定,,,,,,福岡県中間市中間1-1-1,093-244-1111,,093-245-5598
木下 雅文,PA,北九州本社,（前）株式会社,ジェイリンク,ジェイリンク,運輸業・郵便業,,複数地域,,創業30年以上,,,,福岡県北九州市小倉北区竪町1-6-7,093-581-6363,,
木下 雅文,PA,北九州本社,（前）株式会社,ミクニ,ミクニ,不動産業・物品賃貸業,,複数地域,,創業30年以上,,,,福岡県北九州市小倉北区紺屋町12-4,093-521-0392,,093-521-0399
木下 雅文,PA,北九州本社,（前）株式会社,トッパングラフィックコミュニケーションズ,トッパングラフィックコミュニケーションズ,製造業,,全国展開,,創業10年以上,,,,東京都板橋区志村1-11-1,03-3968-5046,,03-3558-0204
木下 雅文,PA,北九州本社,その他,北九州市役所,キタキュウシュウシヤクショ,公務（他に分類されるものを除く）,,地域限定,,創業30年以上,,,,福岡県北九州市小倉北区城内1-1,,,
木下 雅文,PA,北九州本社,（後）株式会社,APAMAN,アパマン,不動産業・物品賃貸業,,全国展開,,創業10年以上,,,,東京都千代田区丸の内1-8-1丸の内トラストタワーN館19階,,,
木下 雅文,PA,北九州本社,（前）株式会社,プライムプレイス,プライムプレイス,生活関連サービス業・娯楽業,,全国展開,,創業10年以上,,,,福岡県北九州市小倉北区室町1-1-1,,,
木下 雅文,PA,北九州本社,なし,行橋商工会議所,ユクハシショウコウカイギショ,サービス業（他に分類されないもの）,,地域限定,,創業30年以上,,,,福岡県行橋市中央1-9-50,0930-25-2121,,0930-25-3488
田代 健志,PA,北九州本社,（後）株式会社,福岡トヨペット,フクオカトヨペット,卸売業・小売業,,地域限定,,創業30年以上,,,,福岡県福岡市博多区東光1-6-13,092-411-1121,,092-474-2115
田代 健志,PA,北九州本社,（前）株式会社,トヨタレンタリース博多,トヨタレンタリースハカタ,不動産業・物品賃貸業,,地域限定,,創業30年以上,,,,福岡県福岡市博多区東光1-6-13,092-472-8355,,092-472-8376
田代 健志,PA,北九州本社,（後）株式会社,朝日建物管理,アサヒタテモノカンリ,サービス業（他に分類されないもの）,,複数地域,,創業30年以上,,,,大阪府大阪市北区中之島2-3-18中之島フェスティバルタワー18階,06-6203-0522,,06-6203-0525
田代 健志,HC,北九州本社,（前）株式会社,オートウェイ,オートウェイ,卸売業・小売業,,地域限定,,創業30年以上,,,,福岡県京都郡苅田町苅田3787-62,093-436-4800,,093-436-3100
田代 健志,PA,北九州本社,その他,公益財団法人アジア成長研究所,アジアセイチョウケンキュウジョ,学術研究・専門・技術サービス業,,,,創業10年未満,,,,福岡県北九州市小倉北区大手町11-4,093-583-6202,,093-583-6576
田代 健志,PA,北九州本社,その他,公益財団法人アジア女性交流・研究フォーラム,アジアジョセイコウリュウ・ケンキュウフォーラム,学術研究・専門・技術サービス業,,,,創業30年以上,,,,福岡県北九州市小倉北区大手町11-4北九州市大手町ビル3階,093-583-3434,,093-583-5195
