営業担当,取扱会社種別,取扱事業所名,法人形態,顧客名,顧客名（カナ）,業種,会社規模,事業展開地域,取引拡大可能性,社歴,信頼性,所属部署,顧客担当者名,顧客住所,電話番号,メールアドレス,FAX
穂束 和美,HC,北九州本社,その他,長崎県土地家屋調査士会,ナガサキケントチカオクチョウサシカイ,,,,,,,,,長崎県長崎市桜町7-6-101サンガーデン桜町,095-828-0009,nagasaki@trust.ocn.ne.jp,095-828-2629
木下 雅文,PA,北九州本社,その他,公益財団法人北九州観光コンベンション協会,キタキュウシュウコンベンションキョウカイ,,,,,,,,,福岡県北九州市小倉北区浅野3-8-1,,,
木下 雅文,PA,北九州本社,その他,公益財団法人北九州市芸術文化振興財団,キタキュウシュウシゲイジュツブンカシンコウザイダン,,,,,,,,,福岡県北九州市小倉北区室町1-1-1-11リバーウォーク北九州5階,093-562-3016,,093-562-3017
木下 雅文,PA,北九州本社,その他,中間市役所,ナカマシヤクショ,,,,,,,,,福岡県中間市中間1-1-1,093-244-1111,,093-245-5598
木下 雅文,PA,北九州本社,（前）株式会社,ジェイリンク,ジェイリンク,,,,,創業30年以上,,,,福岡県北九州市小倉北区竪町1-6-7,093-581-6363,,
木下 雅文,PA,北九州本社,（前）株式会社,ミクニ,ミクニ,,,,,創業30年以上,,,,福岡県北九州市小倉北区紺屋町12-4,093-521-0392,,093-521-0399
木下 雅文,PA,北九州本社,（前）株式会社,トッパングラフィックコミュニケーションズ,トッパングラフィックコミュニケーションズ,,,,,,,,,,,,
木下 雅文,PA,北九州本社,その他,北九州市役所,キタキュウシュウシヤクショ,,,,,,,,,福岡県北九州市小倉北区城内1-1,,,
木下 雅文,PA,北九州本社,（後）株式会社,ApamanProperty,アパマンプロパティ,,,,,,,,,福岡県北九州市小倉北区浅野2-14-3あるあるCity2号館3階 ,,,
木下 雅文,PA,北九州本社,（前）株式会社,プライムプレイス,プライムプレイス,,,,,創業10年以上,,,,福岡県北九州市小倉北区室町1-1-1,,,
田代 健志,PA,北九州本社,（後）株式会社,福岡トヨペット,フクオカトヨペット,,,,,,,,,福岡県福岡市博多区東光1-6-13,092-411-1121,,092-474-2115
田代 健志,PA,北九州本社,（前）株式会社,トヨタレンタリース博多,トヨタレンタリースハカタ,,,,,,,,,福岡県福岡市博多区東光1-6-13,092-472-8355,,092-472-8376
田代 健志,PA,北九州本社,（後）株式会社,朝日建物管理九州支店,アサヒタテモノカンリキュウシュウシテン,,,,,,,,,福岡県北九州市小倉北区室町1-1-1リバーウォーク北九州朝日新聞社棟8階,093-561-0231,,093-561-0315
田代 健志,HC,北九州本社,（前）株式会社,オートウェイ,オートウェイ,,,,,創業30年以上,,,,福岡県京都郡苅田町苅田3787-62,093-436-4800,,093-436-3100
